{
  "$schema": "../../schema/service-binding.schema.json",
  "version": 1,
  "kind": "ros_service_server",
  "rpc": {
    "client_endpoint": {
      "node_id": "hakoniwa-pdu-ros-service",
      "endpoint_id": "client_ep_id"
    },
    "endpoint_config": "rpc-endpoints.json",
    "delta_time_usec": 1000,
    "time_source_type": "real"
  },
  "bindings": [
    {
      "ros_name": "/add_two_ints",
      "ros_type": "example_interfaces/srv/AddTwoInts",
      "hakoniwa_service": "Service/Add",
      "server_endpoints": [
        {
          "node_id": "server_node",
          "endpoint_id": "server_ep_id"
        }
      ],
      "max_clients": 4,
      "timeout_msec": 3000
    }
  ]
}
